Char_Name;Name_Jap;Name_Nick;Char_Data
Guts;Guts  (ガッツ);"Guts ""The Black Swordsman, Kuroi Kenshi, Hundred Man Slayer, Heartless Swordsman, Struggler"" ";"
Eyes: brown
Hair: black

white stripe after use of Berserker armor
Height: 6'3"" (190 cm)
6'8"" (204 cm) post volume 26
Weight:
254 lbs (115kg) post volume 26
Guts is the protagonist of the story. He is a tall, muscular man with a huge sword called the Dragon Slayer, a prosthetic left forearm that has a magnetic grip which also conceals a cannon. Guts is a tragic hero; he is born as one who may be able to struggle against Causality, but seemingly unable to affect it on a large scale.

Note: His name has often times been translated by some English scanlation groups as ""Gatts,"" or ""Gutts,"" or ""Gattsu."" However, the official translation provided to Dark Horse Comics by Kentaro Miura himself, is in fact, ""Guts."""
Griffith;Griffith  (グリフィス);"Griffith ""The White Hawk, The Hawk of Light, Femto"" ";"
Griffith is the main antagonist of the series. He was the founder and leader of the mercenary unit known as the Band of the Hawk, named for his helmet which was forged in the shape of a Hawk's head.

Extraordinarily charismatic, intelligent, and handsome, his skill with his sabre and tactics gives him and his band the reputation of invincibility, making him the favored choice of the Midland King, who was locked in a century long war with the Empire of Chuder.


Believing that he is destined for greater things than the average man, Griffith is willing to sacrifice everything for the dream of his own kingdom and only values others so far as they are useful to him. The one exception seems to be Guts and Casca, both of whom he confides to in private moments. The source of his ambition is a Behelit given to him by a fortune teller she claimed was ""The Egg of the King,"" which could lead an average person to becoming King himself."
Casca;Casca  (キャスカ);"Casca ""Elaine"" ";"
Casca was the only female soldier in the original Band of the Hawk and is behind only to Guts and Griffith in swordsmanship. Her ambivalent relationship to both of them makes her moody and capricious. Casca joins the Band of the Hawk after Griffith saves her from a sexual assault by a nobleman."
Schierke;Schierke  (シールケ);Schierke  ;"
Schierke is a young witch-in-training, a disciple of the witch Flora. She is accompanied by an elf, Evarella. She aided Guts's group with a troll infestation in the nearby village Enoch, where she showed how powerful magic can be in Berserk.

After a series of events, Schierke was forced to leave her home and Flora behind forever when they faced an attack Griffith ordered. Schierke, having lived a sheltered life, doesn't like the Human world or the Holy See's religion, but she finds life outside bearable due to her companions.

Her magic skills and knowledge of the world are impressive for a child her age. One of her most used and handiest spells is the ability to hypnotize or temporarily desensitize others. But due to her youth, she tends to exhibit dangerous overzealousness. Her ability to sense ""Od"" (life force or spirit energy) means she can sense the power, intent, and alignment of all creatures and artifacts.

As she sees Isidro as an incompetent monkey, there is some friction between the two, which frequently lends itself to comic situations. Though she initially couldn't stand Guts, Schierke has developed a slight infatuation with him and both now share a father-daughter relationship. When Sonia gave her an offer to join the Band of the Hawk, Schierke thought of Guts before declining. Their journey together constantly brings them into even deeper understanding."
Puck;Puck  (パック);Puck  ;"
A wind spirit from Elfhelm, a utopia on the island Skellig in the Western Sea. Elves in Berserk can only be seen by the open-minded; the devoutly religious cannot see Puck at all, though he can play with their face unbeknownst to them. Puck can secrete a powder from his wings to quickly heal wounds and can emit a bright flash to blind enemies. On occasion, he also resorts to his ""Bloody Needle"" attack, tossing a spiny object resembling a seed pod at someone. It deals no injury, but is painful enough to prompt most victims to cry out. Puck was the first to join Guts's journey, and is starting to show a strange attachment to the Behelit Guts took upon his battle with the Count.

Puck often serves as comic relief along with Isidro. The two are frequently drawn in an exaggerated manner. He is very angry when he ever is mixed up with a Pixie or Fairy quick to state the difference. He also seems to have a brother-sister relationship with the newest comic relief character the female elf Evarella.

(Source: Wikipedia)"
Serpico;Serpico  (セルピコ);Serpico  ;"
Serpico is Farnese's companion and unbeknownst to her, her paternal half-brother. During his time with the Holy See, Serpico was Herald for the Holy Iron Chain Knights.

When aggressive, Serpico belies his meek appearance and is comparable to a fox due to his shrewd observation and speed with a rapier.

Despite Farnese's childhood abuse and her forcing him to burn his own mother at the stake, he cares deeply for his half-sister. Serpico was her servant since she found him beaten on a snowy street over a decade ago.

Serpico's relationship with Guts has forever been plagued with animosity, due in large part to the dangers that inevitably surround Guts and anyone he takes into his Band. After a duel with Guts in the underground pillars of Vritannis, Guts spared his life. Their bond rekindled, and Serpico has since learned to trust Guts to protect Farnese when he can not.

Serpico uses two items blessed by the wind spirit Sylph in order to battle with tolerance alongside Guts: a rapier that can generate razor sharp gusts of wind; and a cloak that constantly generates a swirling vortex around its wearer which can deflect projectiles, assist in jumping, and slow falls from great heights."
de Vandimion, Farnese;Farnese de Vandimion (ファルネーゼ・ド・ヴァンディミオン);"Farnese ""The Devil Child of Vandimion, Wandering Princess"" de Vandimion";"
Farnese is a noblewoman who led the Holy See's ceremonial guard, the Holy Iron Chain Knights. Since this position has been traditionally held by a woman, Farnese was appointed during her stay at the convent she was sent to by her father, Federico Vandimion.

A bit of a pyromaniac (and possibly a pyrophiliac), Farnese's habit of maniacally burning things she didn't like, along with her lack of empathy due to her poor upbringing provoked her to hunt down and burn supposed witches and pagans at the stake. This fueled a secret sadistic pleasure that she constantly tried to deny.

She and Serpico left their Holy See positions after her faith was shattered during the devastation of Albion and the events surrounding Griffith's reincarnation. She then chose to follow Guts in hopes of learning more about the world and has changed into a more sympathetic human being. Since then, Farnese has begun to study witchcraft under Schierke's tutelage. Farnese also seems to have developed a crush on Guts which becomes evident in chapter 287 and 288 of the manga.

Farnese is primarily Casca's care taker and thus rarely involves herself in battles. She and Casca both received enchanted chainmail shirts made of silver as well as a silver short sword for protection against creatures from the astral plane. During Ganishka's raid on Vritanis, she also received a trio of snake-like homonculi created by Schierke from thorn vines which Farnese remote controls with a vine ring."
Isidro;Isidro  (イシドロ);Isidro  ;"
A runaway brat turned thief, Isidro dreams of becoming a great swordsman, which made him tag along with Guts. Despite his lack of strength and skill, he utilizes his small size and agility to his advantage, along with various tricks and tools. He has a great ego and plans to become the very best; he initially planned to ""observe"" Guts and steal his ""techniques"" to surpass him. But he slowly starts to realize the inconceivable difference in strength between him and Guts, but that there may even be ways for him to become a formidable warrior...

His most important role however, is probably to serve as a comic relief along with Puck."
The Skull Knight;The Skull Knight  (髑髏の騎士);The Skull Knight  ;"
The Skull Knight is one of the most mysterious and prolific characters introduced in Berserk, a towering warrior dressed in full armor whose ornaments, especially his helmet, are shaped as parts of a human skeleton, hence his moniker, who rides a massive, ghostly black horse. Though ominous and macabre, he is an enemy of the Godhand and its acolytes, hunting down Apostles and devouring their Behelits; especially bitter is his rivalry with Zodd the Immortal, whom he was often showed to overwhelm with ease.

He wields a powerful sword that, when stuck down his throat, becomes a terrible, Behelit-coated blade capable of slashing rifts through reality itself, thus allowing the Skull Knight to move freely around the world or even between different dimensions.


This enigmatic knight saved Guts in more than one occasion, notably during the infamous Eclipse which saw Griffith become a member of the Hand of God or when Slan almost slaughtered him, though he never explained why, simply declaring that the Struggler (the way he calls Guts) has to keep following his fate.

It is heavily speculated that, during his life as a mortal, the Skull Knight was in fact Gaiseric, the warlord that unified the Midland and became its first Emperor, notorious for his helmet whose shape was that of a human skull and whose ambitions 'prompted God to send four Angels' (most likely the four members of the Hand of God) to punish him.

He was the wearer of the Berserker's Armor, and knew the witch Flora. During the duel between Griffith and Ganishka he suddenly appeared out of thin air through a dimensional rift, trying to land a fatal blow on the Hawk, only to see it diverted on the writhing body of the Kushan Emperor."
Judeau;Judeau  (ジュドー);Judeau  ;"
The old Band of the Hawk's friendly mediator. A former circus performer who wielded throwing knives, Judeau was also well-aware of the world around him and was seen as a confidant for many of The Hawks. Throughout his stay with the Band of the Hawk, he was secretly in love with Casca, but never acted on it out of respect for Guts' and Casca's feelings for each other."
Zeppeli, Gyro;Gyro Zeppeli (ユリウス・カエサル・ツェペリ);"Gyro ""Julius Caesar, J-lo"" Zeppeli";"
Born Julius Caesar Zeppeli, but more commonly referred to as ""Gyro Zeppeli"".

Gyro has a cocky and flamboyant personality, appearing to have a high opinion of himself. However, he can be driven by emotions for other people and become realistic and serious when a problem presents itself. Like most Manga archetypes, Gyro is incredibly intelligent when he needs to be. His most distinguishable body features are his long hair, western hat and his gold teeth which have ""GO! GO! ZEPPELI"" displayed on them, revealed whenever he smiles at someone. His signature laugh/chuckle is ""Nyo ho ho ho~"".

Note that the ""Caesar"" in his name is pronounced in the traditional Greek way, more akin to the German ""Kaiser"". This is distinct from Caesar Anthonio Zeppeli from JoJo's Bizarre Adventure Part 2, whose name is pronounced in the modern English way.


In the final battle against Funny Valentine, Gyro uses the most advanced technique of the Golden Rectangle: the ""Super (or Cavalry) Spin"", which is created by invoking the golden rectangle while riding a horse to gain momentum. By combining this technique with his newly developed stand Ball Breaker, his attack becomes very powerful. Although his technique is very effective, it is not enough to beat Valentine, who resists his injuries long enough for Gyro to die from his own wounds. However, before dying, Gyro gives his last lesson to Johnny, allowing Tusk to reach ACT 4 and giving Johnny the power to defeat Funny Valentine."
Joestar, Johnny;Johnny Joestar (ジョニィ・ジョースター);"Johnny ""Jonathan, Joe Kid, JoJo"" Joestar";"
Johnny Joestar, also known as ""Joe Kid"" or ""JoJo"", was a racing prodigy. However, when waiting in line for a play, the girl he was with convinced him to cut to the front of the line and bribe the bouncers to throw out the youth in the front of the line, who had been waiting through the night. The youth shot Johnny, resulting in his being paralyzed from the waist down and sent to a hospital, where he was physically abused. Having lost all the friends and respect he had earned as a jockey, no one visited him during his stay in the hospital.

Near the beginning of the series Steel Ball Run, Johnny Joestar encountered Gyro Zeppeli and was brought to his feet upon touching Gyro's steel ball. Believing Gyro to be capable of teaching him to walk, Johnny joined the Steel Ball Race and followed him to be trained.


Johnny earns a Stand named ""Tusk"" when they venture into the Devil's Palm as a result of their fight with Dio and Dr. Ferdinand. Tusk is able to fire Johnny's spinning fingernails similar to a revolver, with the nails having to take a few seconds to regrow. This long range attack becomes his primary means of defense. His Stand is small in size and has the same star-pattern over it as on Johnny's clothing, it appears to reside inside of him and only comes out to offer advice. It cannot speak, only make animal-like noises. Later in the series, Johnny masters Gyro's ""Spin"" technique and uses it with his Stand's fingernail bullets; at one time, even being able to use it on himself. His Stand also evolves although remaining similar in appearance, now able to fire from the toenails on Johnny's paralyzed feet.
(Source: Wikipedia)"
Valentine, Funny;Funny Valentine (ファニー・ヴァレンタイン);Funny  Valentine;"
Funny Valentine is the main antagonist of Part 7. He is the twenty-third president of the United States. He is using the Steel Ball Run race to collect the scattered remains of Jesus Christ around the United States. He will do so by fair means or foul, sending assassins to eliminate Gyro for the purposes of retrieving the Saint's body. He was a former soldier, discharged after being tortured during a war; he has scars similar to the Stars and Stripes on his back.


His Stand is Dirty Deeds Done Dirt Cheap (often referred to as D4C). It allows different parallel worlds/dimensions to co-exist at the same time and/or in the same place. It also allows it's user to visit these parallel (near)worlds/dimensions and interact with them.
(Source: Wikipedia)"
Brando, Diego;Diego Brando (ディエゴ・ブランド);"Diego ""Dio"" Brando";"
Dio's alternate universe counterpart in Part 7 of JoJo's Bizarre Adventure, Steel Ball Run. under the name of Diego Brando (commonly referred to by his nickname Dio by other characters). He is very similar to the ""original"" Dio in both looks and personality, however, Diego is a famous professional jockey from England participating in the Steel Ball Run race across North America. He was raised among a group of homeless people, after his mother saved him from drowning in a river when he was still a baby. He was later adopted into nobility when his talent as a jockey was discovered. Although he was raised with much love, he is cold-hearted and will do virtually anything to win. After he loses the first stage of the Steel Ball Run to Gyro Zeppeli, he gets mad and considers Gyro his personal enemy from that point onwards. .

(Source: JJBA Wiki)"
Steel, Lucy;Lucy Steel ;Lucy  Steel;"
Lucy Steel is the wife of Steven Steel, the organizer of the Steel Ball Run. Lucy's involvement with the story truly begins when Funny Valentine is introduced. Lucy finds out that Funny Valentine plans to gather the bones of ""The Saint"" for his own needs and also kill Steven Steel. Lucy goes to great lengths to prevent this from happening.


Later on Lucy tries to help Hot Pants steal back the heart of Jesus'; corpse from the president by disguising herself as the president's wife. She is captured by Valentine though and is chosen by the corpse to be it's user, turning her into an artificial Stand user and allows her to use it's ""holy field"" inducing ability that Valentine plans to use to become the leader of the world."
Christ, Jesus;Jesus Christ ;Jesus  Christ;"
According to the story told in the manga, after Jesus' resurrection, he thanked Joseph of Arimathea for the care of his body and stated that he would travel to the east. When Joseph asked him about a future meeting, Jesus made a map in the sand showing Joseph nine locations.

Jesus then traveled east across the continent, learning new languages and cultures until he reached the sea. Making a ship with the help of the locals, he set off across the sea to what would be known as America, where he lived, aged, and was finally put to rest. He seemed to have at least partial connection with the natives, who stated prior to his deathbed that they wished to see him. Shortly after his death, a large earthquake tore the ground apart, dividing his corpse by the movement of sand and relocating it to the different areas of America that would become the nine locations on Joseph of Arimathea's map.

(Source: JJba Wikia)"
Roadagain, Ringo;Ringo Roadagain ;Ringo  Roadagain;"
Ringo Roadagain is introduced during the 4th Stage of the Steel Ball Run. He traps Gyro, Johnny, and Hot Pants near a cabin located in a forest. Ringo challenges Johnny to kill him, and claims it's the only way to escape. Once Johnny and Hot Pants are bested, he permits Gyro to leave, or enter the ""True Man's World.""

His stand is Mandom. The stand can reverse six seconds of time by turning his wristwatch back six seconds."
Hot Pants;Hot Pants  ;"Hot Pants ""HP"" ";"
Hot Pants is first seen at the end of the 3rd Stage of Steel Ball Run. ""He"" runs into Gyro and Johnny before meeting Ringo Roadagain. It's revealed after the battle with Ringo that Hot Pants is actually a woman.

Her stand is called Cream Starter. It is a spray that can change flesh into foam and relocate any flesh it absorbs. It can also heal wounds in the same way.


When she was a child, her brother and she were attacked by a grizzly bear and hid in a rock crevice. Hot Pants only managed to survive because she sacrificed her brother's life by pushing him out of the crevice. Her hometown's people thought it was a tragic accident, but Hot Pants became unable to bear the burden of the truth surrounding her brother's death. She became a nun, hoping to earn forgiveness from God and her brother. In 1890, she came to America as an agent of the Vatican to collect the Corpse Parts. She believes that the Holy Corpse can cleanse her ""sin"". She sides with Diego in the battle against Valentine, but dies by flying out of the train."
Brando, Alternate Diego;Alternate Diego Brando (ディエゴ・ブランド);Alternate Diego  Brando;"
This Diego is introduced after the death of the original to the ""root world"" of the Corpse by Funny Valentine. He is a racer from a similar Steel Ball Run happening in another universe. Upon request from the President and coveting the Saint's Corpse, he confronts Johnny Joestar in the final stage of the Steel Ball Run. (Source: JoJo's Wikia)"
Wekapipo;Wekapipo  (ウェカピポ);Wekapipo  ;"
Wekapipo is introduced near the end of Stage 6 of the Steel Ball Run race. Originally, he was an imperial guard, but was exiled out of the country by Gyro Zeppeli's father. He now works with the President to get the corpse parts and kill Gyro and Johnny in return for citizenship and residence in the United States as well as a high ranking position in the government.

His stand name is Wrecking Ball. It's a steel ball that has 14 ""satellites."" When used, the shockwaves of being hit by the satellites makes the target loose the sensation in the left side of their body."
