Char_Name;Name_Jap;Name_Nick;Char_Data
Akagi, Takenori;Takenori Akagi (赤木 剛憲);"Takenori ""Gori"" Akagi";"
Year: 3rd Year
Height: 197 cm
Weight: 90 kg
Jersey Number: #4
Position: Center

Takenori Akagi is the captain of the Shohoku basketball team and Haruko's older brother. Despite at first not thinking too much of Sakuragi (who addresses him as ""Gori"" for gorilla due to his immense physical presence), he actually realizes Sakuragi's potential as a basketball player. Serious and disciplined, Akagi's dream is to lead Shohoku to the national championship. His determination is shown in the match against Kainan, where he played on despite a serious injury to his ankle. Akagi considers Uozumi of Ryonan to be his biggest rival, though their rivalry is not antagonistic; indeed, there is respect that borders on friendship.

Akagi differs from the other starters in two respects. First, he is the most academically talented out of all them and is considered a model student. After the loss to Aiwa knocks Shohoku out of the Nationals, Akagi leaves the team along with Kogure to study for the college entrance exams. In contrast, the other four had to beg their teacher to be given the chance to retake some exams they had flunked; they would otherwise have been disqualified from playing in the Nationals for having failed too many classes. Second, Akagi is the only starter not to have gotten into an actual fight, although he has used physical force against his own players (most notably Sakuragi, and once Mitsui after the gym fight) to keep them in line. He is the only other character besides Rukawa able to take one of Sakuragi's trademark headbutts without being knocked out and the only other character who has had Sakuragi inadvertently dunk a ball on his head (Murasame of Miuradai was the second, in the manga; in the anime, the second one to be dunked on the head is Naito, also from Miuradai).

Regarded as the best center in the Kanagawa prefecture, Akagi plays as a fairly typical center, using his height and power to score close to the basket. He also has a reputation for being a virtually unbeatable defender. As captain of the team, he keeps discipline among his players during matches. Akagi met his match during the game against Sannoh, in the form of Masashi Kawata, considered one of the best centers at the high school level. Initially intimidated when Kawata outplayed him, he regained his confidence thanks to Uozumi's encouragement and led his team to victory.

(Source: hoopedia.nba.com)"
Sendou, Akira;Akira Sendou ;"Akira ""The Genius, Ryonan's Ace Player"" Sendou";"
Age: 16-17
High school: Ryonan Highschool
Middle school: Kitazawagakuen Jr. in Tokyo
Year: 2
Height: 190 cm (6'3)
Weight: 79 kg (174 lbs.)
Position: point guard (PG) and small forward (SF)
Jersey no.: 7
Shoe Brand: Converse

Sendou is in contrary to most of the Slam Dunk characters a very nice and warm person. He always smiles and is friendly and modest, although he surely knows that he is a more than marvelous player. He never loses his temper and shows respect to strong players, but definitely won't give away any game! He's a fighter for victory no matter what. The only problem he might have is his lack of focus when he meets an opponent that's not very strong. His concentration is optimal when he's playing rivals such as Rukawa and Maki; such guys bring up the best in him.

Sendou is a good shooter, nice rebounder and also a strategist of the game. He's able to play fancy offense but also great defense to stop outstanding forwards such as Rukawa. Despite his height he's a very speedy and flexible player. He ain't the Genius for nothing. Sakuragi likes to call himself the Genius, but Sendou is called the true Genius by others.

In his first year of high school he was a small forward and literally a scoring machine (similarity with Rukawa), but in his second year he figured the fun of passing the ball and upgraded the whole team. His sight on the game is outstanding and his senses are very high; thanks to these facts he became the excellent point guard of the team, which is quite exceptional for such a tall player. But he does his job very well and is without a doubt the ace player of Ryonan. Along with Fukuda and Uozumi they form the strongest offense of Kanagawa.

Not only is he the ace player, he's also the mental support of the team, when things are going wrong, the team members keep having faith in their star player. Sendou is the kind of player that can bring up the best qualities of others. He's a reliable player: when the team is behind, he'll show his scoring ability again without losing the focus on the game. He knows what the best is for his team. It's often said that Sendou is the true captain of Ryonan instead of Uozumi, because he has the ability to calm down the team, and also fire up and unify the team. When Uozumi retires from the game Sendou becomes the new captain."
Mito, Youhei;Youhei Mito (水戸 洋平);Youhei  Mito;"
Sakuragi's best friend. He is also a very good fighter when needed."
Akagi, Haruko;Haruko Akagi (赤木晴子);Haruko  Akagi;"
Year: 1st Year

Haruko is Takenori's younger sister and Sakuragi's love interest. Sweet and with a captivating personality, Haruko is always around to cheer on the players, especially her brother Takenori (who is extremely protective of her and taught her the basics of basketball) and Sakuragi, whom she considers as her best friend. Haruko often appears at matches together with Sakuragi's cohorts and her two best friends, Fujii and Matsui. She, like most girls in Shohoku High, only has eyes for Kaede, although he never reciprocates her feelings and, later in the anime, she acknowledges that he won't love her the way she wants him to and tries to let go of her crush, however not successful.

Haruko was responsible for uncovering Sakuragi's athletic talent after seeing him try to dunk a ball at her request - she was impressed by the height of his jump and considered him good enough to join the team. Hanamichi always listens to Haruko, due to his deep affection for her. They have gone on some (what Sakuragi considers) non-official dates and have occasionally trained together.

Despite her emotional denseness and sweetness, Haruko is a pretty good student (she helped Akagi tutor Sakuragi and the other three starters when they had to retake some tests) and is not afraid to stand up for others when needed. She confronted Sakuragi when she mistakenly thought that he had attacked Rukawa, and she also defended him many times from Kaede's most rabid fangirls (one of them even knocked her to the ground in the anime series).

(Source: Wikipedia)"
Anzai, Mitsuyoshi;Mitsuyoshi Anzai (安西 光義);"Mitsuyoshi ""White-Haired Buddha"" Anzai";"
The coach of the Shohoku High basketball team, and one of the best ones in Japan. Even the coaches of other teams call him ""Anzai-sensei"" with respect. His calm and collected attitude contrasts with the temper he had in the past, when he was nicknameed ""White-Haired Devil"" as a demanding college coach.

A talented player, Ryuji Yazawa, trained under him and was eyed with high regard by Anzai. However, Yazawa was unhappy about Anzai's tough training for him (especially the repetitive and strenuous basic technique training), and against the Coach's wish, left Japan to play in the USA, where he thought he would have better opportunities to show his talent. 5 years passed without any news, other than an unaddressed video tape showing Yazawa playing in a team, whose players had virtually no concepts of teamwork. One day Anzai learned from the press that Yazawa died in a high-speed head-on car collision, reportedly under drug influence. While visiting Yazawa's grave, Yazawa's mother gave Anzai a letter written 4 years prior, which Yazawa never had the courage to post back. In the letter, Yazawa expressed profound regret about his rebellious decision to leave, and the depression from his experience in the unsupportive American college basketball career. Anzai grieved deeply for the loss of Yazawa and resigned from college basketball coaching ever since. This also changed Anzai's former strict attitude to his now mild temper, for which he is now known as the ""White-Haired Buddha.""

Sakuragi always calls Coach Anzai ""Oyaji"" (old man) and has the habit of jiggling his fat when hyped, which makes the others - Mitsui in particular - mad at him, as this is considered disrespectful. Anzai, however, appears to tolerate this and has not reprimanded Sakuragi for his behavior. However, Anzai did punish the four players (Mitsui, Miyagi, Sakuragi and Rukawa) involved in the fight against Mitsui's gang, by initially benching them during the first interhigh tournament match against Miuradai High School.

However behind such an impassible demeanor is a brilliant strategist, who always knows how to turn the tide of a match for his team. Anzai like Haruko Akagi, realized Sakuragi's potential early on and decided to make him a starter even though some of his basketball skills were not yet par. Recognizing that shooting was Sakuragi's weakness, he made him make 20,000 baskets in a week to get ready for the national tournament. Anzai is also very charismatic and able to inspire his players to greater heights, as evidenced before the match against Sannoh, where he managed to bring down the insecurity within Miyagi, Mitsui and, to a lesser extent, Sakuragi. Although they were directly recruited by Coach Moichi Taoka of Ryonan, both Mitsui and Ryota turned him down, citing Anzai's presence at Shohoku as the primary factor. Mitsui respects Anzai the most, and once put a picture of him on the bench and prayed to it when Anzai was unable to come to the inter-high Shohoku-Ryonan match due to heart attack.

(Source: Wikipedia)"
Fujima, Kenji;Kenji Fujima ;Kenji  Fujima;"
Year: 3rd Year
Height: 178 cm
Weight: 66 kg
Position: Point Guard/Coach
Jersey Number: #4

Kenji Fujima is the player/coach of Shoyo High. As such, he only enters the court when is presence is really needed, such as when the team is behind and struggling. Fujima is so respected by his teammates that as much as possible they try not to make it necessary for him to get on the court, and even the hint of his getting off the bench to join them inspires them to play harder. His personality also varies depending on which role he is playing in the game; as a coach and off the court, he is calm, mild-mannered and friendly (he even personally deals with his fangirls and is very kind to them), but he becomes confident, high-spirited and even ruthless when he's on court. As Maki says in volume #10, ""As a player, he's far from rational.""

Fujima plays as a typical point guard, leading his team and passing the ball, but also shooting and scoring when necessary. He is one of the top point guards in the Kanagawa prefecture and a force to be reckoned with on the court.

Fujima is referenced during the first round of the National Championships when Shohoku plays against Toyotama High School. Toyotama's captain, Tsuyoshi Minami, known as the ""Ace Killer"" injured Fujima in a match resulting in his removal from the game due to his injury. Subsequently, Shoyo lost the match to Toyotama."
Otonashi, Maria;Maria Otonashi (音無 麻理亜);"Maria ""Aya"" Otonashi";"
An antisocial beauty with a resolute personality. She transfers into Kazuki's class on March 2nd—right before the end of the school year. Immediately upon her arrival, she announces her intent to ""break"" Kazuki.


Maria is the main female heroine of the Hakomari series. Maria is a box herself. She once met ""O"" who offered her a box. Her wish was to become a box herself so that she could grant the wishes of other people. Of course her wish could not come free of charge, so every time she uses her box she loses her memories. Her box is able to give people a place where they can be happy, however she knows that this place is only fake, and the happiness is only fake. Her life first intertwines with Kazuki when she sneaks into Mogi's box that created the recurring classroom. Being a box herself, she is able to keep her memories each recurrence. She spends years searching for the one who has the box and created the recurring classroom. During this time she also spent lots of time obtaining new skills, such as martial arts and how to ride a motorcycle. Eventually, have Kazuki uses the name ""Maria,"" a name she only used in a previous classroom, she determines that Kazuki must own the box because he could remember things. Kazuki however is unsure of whether he owns it himself, and doesn't know how to give the box up even if he wanted to. Maria expresses her intent to break him, and declares war on him. Maria eventually realizes that Kazuki doesn't have the box after Kazuki himself gets run over by the truck and the box doesn't end. She then decides to team up with Kazuki in order to find the real culprit of the box.

After Kazuki ""kills"" Iroha Shindou to save Maria who was supposedly kidnapped on Oomine's orders, she feels he betrayed her and decides to live not as Maria Otanashi, but as the box Aya Otanashi. She saves Daiya Omine after he gets stabbed by a former follower after he lost his box to Kazuki, but in turn forgets about him and everyone he knows, including Kazuki.

After she she watches Kazuki gradually losing his sanity being inside her box, she accepts the death of her sister, Aya Otanashi, and merges with the original zeroth Maria. She takes care of Kazuki after he loses his sanity, until he gradually recovers his mind. They marry each other in the end.
(Source: Baka-Tsuki)"
Hoshino, Kazuki;Kazuki Hoshino (星野 一輝);"Kazuki ""Kazu, Hoshii"" Hoshino";"
A completely ordinary high school student who loves idle chatter with his friends and Umaibous, a Japanese snack. One day, he somehow suddenly antagonizes Aya Otonashi—even though he has never met her before. She threatens to ""break"" him.


After killing Kamiuchi inside Kingdom Royale, he started displaying psychotic behavior, going as far as ""killing"" Shindou Iroha just to save Maria, who was supposedly kidnapped on Daiya's orders. Volume 5 SpoilersKazuki's box allows him to crush other boxes. He received this power from Maria and he believes that he is Maria's knight. Volume 7 SpoilersAfter being incorporated into Aya's ""Flawed Bliss,"" Kazuki is forced to repeat a blissful day 400,000 times before he is able to escape and destroy Aya and the ""Flawed Bliss,"" thereby freeing Maria from the shadow of her ""imperfect sister,"" Aya. In the process, his mind breaks from the sheer amount of time spent in solitude, scattering his memories and rendering him unable to preform basic functions such as speaking and even conscious thought for a time. Volume 7 SpoilersAt the end of Volume 7, Kazuki and Maria get married..
(Source: Baka-Tsuki)"
Oomine, Daiya;Daiya Oomine (大嶺 醍哉);"Daiya ""Daiyan, Dai-chan"" Oomine";"
A self-centered and arrogant student who dyes his hair silver and wears three piercings in his right ear. He is also the class president and a shrewd friend of Kazuki.


Kamiuchi believed only he could see Kokone's real beauty during middle school, but Daiya ended up dating her before he could do anything. Daiya used Kamiuchi and his box in order to learn how to master his own. He tricked Hoshino into believing that he was the real owner. In order to save Hoshino, O appears at the end of the fourth round of Kingdom Royale and helps Daiya kill the real Kamiuchi which terminates the box. It is later revealed that he had actually obtained a box called ""The Shadow of Sin and Punishment."" He used the power of his to start the dog-human epidemic and bring people under his control. Daiya is later brought into the ""Wish-Crushing Cinema"" as an attempt to stop him. He forces Kazuki to come into the Cinema himself and has a standoff with him. After Kokone stabbed herself to get Daiya distracted, Kazuki destroyed his box. Afterwards, Diaya is stabbed in the back by fanatic he created as a result of his usage of his box, and remains in a vegetative state for multiple months before recovering consciousness.
(Source: Baka-Tsuki)"
O;O  (オー);O  ;"
A mysterious being introduced in the series as the one who distributes boxes.


O has no set appearance, instead, forming the image of everyone, yet resembling no one. However, O has been known to take on the shape of both humans and other objects. Gender-wise, O is neutral, being both male and female. Although this coincides with O not being able to distinguish between humans, the majority of the characters refer to O with 'he' or 'him'.

In the Rejecting Classroom, she impersonated Haruaki in order to observe Hoshino from up close.

In the Sevennight in Mud, she impersonated Riko Asami in order to observe Hoshino.

Maria has an older sister, Aya Otonashi, and she is the complete opposite of herself. When her family died in an accident, she shouldered the burden herself along with the dark sins.

It is revealed that ""O"" is a creation of Maria's wish and that the name ""O"" comes from ""Otonashi Aya""."
Kirino, Kokone;Kokone Kirino (桐野 心音);"Kokone ""Kiri"" Kirino";"
A bright and beautiful girl who cares a lot for her friends, but can sometimes be meddlesome. She and Daiya have known each other since childhood, and their mutual verbal abuse has become legendary among their classmates ever since.

(Source: Baka-Tsuki)"
Mogi, Kasumi;Kasumi Mogi (茂木 霞);Kasumi  Mogi;"
The girl who has won Kazuki's heart. She is docile, silent and expressionless.


Kasumi Mogi lived a normal life going to school, however she was always depressed. She never showed any emotions herself, she always forced a smile onto her face, and was never happy. She thought everyone else must be faking it too. She thought nobody would ever notice her, until one day a boy ran towards her after she left school. He asked if she was okay, because she seemed bothered. Mogi denied anything bothering her, but at the same time she fell in love with this boy who noticed that her smile was fake. This boy was Kazuki Hoshino. Kasumi Mogi is the owner of the box that creates the recurring classroom in the first volume. Prior to being confronted by 'O' and obtaining the box, she had hit by a truck and was in a critical condition. She felt like she wasn't ready to die now that she had finally found a reason to keep living, which was the boy she fell in love with. In order to be able to tell Kazuki how she felt about he she wished for the recurring classroom. After ending the Rejecting Classroom, she is hit by the truck and severely injured. She survives, but is forced to stay in a hospital for several months while recuperating. She is confined to a wheelchair after the accident.
(Source: Baka-Tsuki)"
Usui, Haruaki;Haruaki Usui (臼井 陽明);Haruaki  Usui;"
A cheerful but frivolous baseball ace. He often hangs out with Kazuki and Daiya.

(Source: Baka-Tsuki)"
Yanagi, Yuuri;Yuuri Yanagi (柳 悠里);Yuuri  Yanagi;"
A timid and shy girl who is a close friend of Iroha Shindou.


Despite her initial appearance, she is skilled at controlling her emotions and using them to manipulate people. She is the real player in the second round of Kingdom Royale. She appears to have feelings for Hoshino and continues to want to spend time with him even after they escape from the box."
Shindou, Iroha;Iroha Shindou (新藤 色葉);"Iroha ""Kaichou"" Shindou";"
The student council president. She is frequently described as a superhuman due to her outstanding ability to concentrate and achieve whatever she wants. She is also a close friend of Yuuri Yanagi.


She is the real player in the third round but ends it quickly by killing the five NPCs with her knife on the first day.

Daiya recognizes her skills when using his box in Volume 5 and shares his Shadow of Sin and Punishment with her. Using this power, she tempts Hoshino into trying to kill her in front of Maria. After this, O explains to Hoshino that he has the power to destroy boxes and he tests out this power by destroying Shindou's Shadow of Sin and Punishment box."
Otonashi, Aya;Aya Otonashi (音無 アヤ);Aya  Otonashi;"
No biography written."
Senjougahara, Hitagi;Hitagi Senjougahara (戦場ヶ原 ひたぎ);"Hitagi ""Tsundere-chan, Gahara-san, Senshougahara-san"" Senjougahara";"
Birthday: July 7
Height: 165 cm
Weight: 45 kg

5 kg when she was under the influence of the heavy crab.
Hitagi, the main female character of
Bakemonogatari
, is a weak-looking girl with an ""incurable disease."" She is in the same class as Koyomi, but he has almost never heard her speak. When she was in the first year of high school, she encountered a mysterious crab, after which she became nearly weightless. Ever since then, she has avoided contact with everyone else, threatening everyone who discovers her secret. She called herself a tsundere and always speaks in an abusive style.


At the end of Mayoi Snail, she admits that she loves Koyomi, and subsequently enters into a relationship with him. After the events in Tsukihi Phoenix, she overcomes all of her trauma, and becomes a rather cheerful and normal girl. She starts calling Araragi with a cute nickname, chuckling at small things and sending e-mails full of emoticons, although her sharp tongue is still there, but toned down. She also seems to have a father complex as she becomes excited to the point of being unable to fall asleep when using her father's blanket."
Oshino, Shinobu;Shinobu Oshino (忍野 忍);"Shinobu ""Kiss-shot Acerola-orion Heart-under-blade, Fair Princess"" Oshino";"
Shinobu is a girl who lives with Meme in an abandoned building. She loves donuts from ""Mister Donut."" She was named Shinobu by Meme at the beginning of Hitagi Crab, suggesting her kanji name Shinobu (忍), having ""heart"" (心) under ""blade"" (刃), matches with her original personality.


She appears to be an eight-year-old girl, but she was originally a beautiful vampire who had lived for more than 500 years. At the end of events of Koyomi Vamp, after Koyomi realizes that having saved his master from a certain death, leaded to a future where she will kill humans (the ""portable food"" she calls them) to ensure her survival, Koyomi revolts against Kissshot in a bloody battle to death, where Kissshot chooses not to use her full powers (in order to have a proper battle with her servant). Later on the battle it is revealed that she pretended to turn Koyomi into a human again, by letting herself be killed by Koyomi. After the shocking revelation, he cannot bring himself to kill his master who was giving her life for his, and who cared for him at the point of risking her life to save his (from sunburn) at the beginning of Spring's Break. But to prevent herself from eating more humans, Koyomi asked for help to Oshino Meme, who in the end tells that as a happy ending won't be possible for everyone, then everyone will have an unhappy ending! While Koyomi himself cannot return to be a fully human, Kissshot Acerolaorion Heartunderblade was left in a weakened condition (where she is no longer able to eat humans, and needs her servant's blood to survive) with no powers or traces of her original personality and therefore have to abandon her ""Kiss-shot Acerola-orion Heart-under-blade"" (キスショット・アセロラオリオン・ハートアンダーブレード) name. Ever since ""Tsubasa Cat"" where she starts living in Araragi's shadow, she no longer needs to suck his blood on a regular basis in order to stay alive. She forms a physical connection with Araragi where they can feel each others emotions and senses. It is also later revealed that she can gain strength into an ""evolved"" form after sucking Araragi's blood more than the usual dosage, she does this in order to fight for Araragi when he confronts Yotsugi and Yozuru. In Mayoi Jiangshi, in the alternate timeline, Shinobu went berserk when Koyomi was killed by Black Hanekawa, feeling that she was somewhat responsible for his death, so she swore to destroy the world and created the Jiangshi that has been swarming the town. It seems that she truly cares about Koyomi and when she saw Koyomi was alive in the alternate timeline, she started weeping blood. In the end, Araragi simply states that he will die together with Shinobu. Her father named her Lola, however she went by the name Acerola.

Note: Aya Hirano was only credited on a drama CD and not for the anime. Please don't try to add her as the VA for Bakemonogatari."
